{
  "schema_version": 2,
  "name": "kev-0.8b-checkpoint",
  "repository": "jaredpalmer/kev-0.8b",
  "revision": "9a45d25eb2ab761841196625383fa1dff0e56c1e",
  "files": [
    {
      "path": "adapter_config.json",
      "size": 1273,
      "sha256": "748acb2cda88454cb1ba69d745ba336f3fcb5486eac349e90960c8b8d8d3e854"
    },
    {
      "path": "adapter_model.safetensors",
      "size": 43338624,
      "sha256": "9b908623acb162118575f4e7a94524f9c139c335be4bfb74d6cfceca01e1885a"
    },
    {
      "path": "head.pt",
      "size": 2103999,
      "sha256": "f400bd12802b2b105ae45d6b03774a158a3db4fccff42413734ddca2e5c920b6"
    },
    {
      "path": "provenance.json",
      "size": 4221,
      "sha256": "fce039fbda7de19451c9b5d3065aee2c5e063e1562a8bc18c72e297fbd15e9d8"
    },
    {
      "path": "tokenizer.json",
      "size": 19989325,
      "sha256": "06b9509352d2af50381ab2247e083b80d32d5c0aba91c272ca9ff729b6a0e523"
    },
    {
      "path": "tokenizer_config.json",
      "size": 1128,
      "sha256": "8671bed7c852ce9e661be94f179a7b4ffd091c2a65aea0363e5501c20318ee45"
    }
  ]
}
